{
  "$schema": "https://json-schema.org/draft/2020-12/schema",
  "$id": "https://toolkit.internal/contracts/data-contract.schema.json",
  "title": "DataContract",
  "description": "Output of data-discovery; input to data-pipeline. Describes target tables grounded in real source objects: mappings, grain, tests, bounded/redacted samples, and per-mapping confidence. A human review gate sits between this artifact and pipeline generation -- see references/toolkit-conventions.md.",
  "type": "object",
  "additionalProperties": false,
  "required": [
    "schema_version",
    "run",
    "contract_id",
    "invocation_mode",
    "grain_determination",
    "tables",
    "assumptions"
  ],
  "properties": {
    "schema_version": {
      "type": "string",
      "pattern": "^\\d+\\.\\d+\\.\\d+$"
    },
    "run": {
      "$ref": "run-manifest.schema.json"
    },
    "contract_id": {
      "type": "string",
      "description": "Stable identifier across re-runs for the same target (e.g. hash of target table names), so a new run's diff can be matched to a previous one."
    },
    "invocation_mode": {
      "type": "string",
      "enum": [
        "greenfield",
        "resolution"
      ],
      "description": "greenfield: input was prose business intent, discovery explored broadly for candidate sources. resolution: input was a model-spec from data-modeling, discovery resolved the already-designed target against real objects."
    },
    "source_model_spec_ref": {
      "type": [
        "object",
        "null"
      ],
      "description": "Required (non-null) when invocation_mode is resolution. Points at the model-spec artifact this contract resolves.",
      "additionalProperties": false,
      "properties": {
        "model_id": {
          "type": "string"
        },
        "schema_version": {
          "type": "string"
        },
        "path_or_uri": {
          "type": "string"
        }
      }
    },
    "grain_determination": {
      "type": "object",
      "description": "How grain was established for this contract as a whole. Per-table grain detail lives under tables[].grain.",
      "additionalProperties": false,
      "required": [
        "method",
        "confidence_basis"
      ],
      "properties": {
        "method": {
          "type": "string",
          "enum": [
            "explicit_constraint",
            "profiled_unique_key",
            "name_and_type_inference",
            "llm_inference_from_naming",
            "undetermined"
          ]
        },
        "confidence_basis": {
          "type": "string",
          "description": "Reference to contracts/confidence-rubric.md category this determination corresponds to."
        }
      }
    },
    "tables": {
      "type": "array",
      "minItems": 1,
      "items": {
        "type": "object",
        "additionalProperties": false,
        "required": [
          "name",
          "target_catalog",
          "target_schema",
          "grain",
          "columns",
          "tests",
          "row_count_estimate"
        ],
        "properties": {
          "name": {
            "type": "string"
          },
          "target_catalog": {
            "type": "string"
          },
          "target_schema": {
            "type": "string"
          },
          "grain": {
            "type": "object",
            "additionalProperties": false,
            "required": [
              "statement",
              "determination",
              "basis"
            ],
            "properties": {
              "statement": {
                "type": "string",
                "description": "One row per <X>, in plain language."
              },
              "determination": {
                "type": "string",
                "enum": [
                  "explicit_constraint",
                  "profiled_unique_key",
                  "name_and_type_inference",
                  "llm_inference_from_naming",
                  "undetermined"
                ]
              },
              "confidence": {
                "type": [
                  "number",
                  "null"
                ],
                "minimum": 0,
                "maximum": 1,
                "description": "Required (non-null) when determination is an inferred category per confidence-rubric.md; null when explicit_constraint or profiled_unique_key (those are measured, not inferred)."
              },
              "basis": {
                "type": "string",
                "description": "Evidence behind the grain determination. Required whenever confidence is present, per confidence-rubric.md."
              }
            }
          },
          "source_joins": {
            "type": ["object", "null"],
            "description": "Non-null only when this table's columns are sourced from more than one source object. Declares exactly how those objects join, as a structured, equality-only condition set -- never a raw boolean SQL expression -- so `data-pipeline`'s `build_transform_spec.py` can render a real multi-table SELECT for a genuine many-to-one lookup join (a denormalizing dimension join, a header-to-line rollup, a dimension surrogate-key lookup) without guessing at a join it was never told. A target with columns from multiple source objects and a null/absent source_joins is refused by build_transform_spec.py, not silently single-sourced -- see skills/data-pipeline/references/other-modalities.md. A join that can't be expressed as an equality condition (a range join, a fan-out-risk one-to-many, anything needing aggregation) has no home in this field at all, by design -- that is exactly the signal transform_complexity: complex_procedural should key off, per skills/data-pipeline/references/decision-rubric.md.",
            "additionalProperties": false,
            "required": ["driving_object", "driving_alias", "joins"],
            "properties": {
              "driving_object": {
                "type": "string",
                "description": "catalog.schema.table -- the grain-defining source object. Matches the source.object of every column whose source.join_alias equals driving_alias."
              },
              "driving_alias": { "type": "string" },
              "joins": {
                "type": "array",
                "minItems": 1,
                "items": {
                  "type": "object",
                  "additionalProperties": false,
                  "required": ["alias", "object", "join_type", "on"],
                  "properties": {
                    "alias": {
                      "type": "string",
                      "description": "Unique among driving_alias and every other joins[].alias in this table -- lets the same object (e.g. a self-joined lookup table) appear more than once with distinct column provenance."
                    },
                    "object": { "type": "string", "description": "catalog.schema.table." },
                    "join_type": {
                      "type": "string",
                      "enum": ["left", "inner"],
                      "description": "left: preserves every driving-side row even with no match (the common lookup-join case). inner: drops unmatched rows -- use only when a human/discovery has confirmed every driving row is expected to match."
                    },
                    "on": {
                      "type": "array",
                      "minItems": 1,
                      "description": "AND-ed equality conditions. Composite-key joins declare more than one item.",
                      "items": {
                        "type": "object",
                        "additionalProperties": false,
                        "required": ["right_column"],
                        "properties": {
                          "left_alias": {
                            "type": "string",
                            "description": "driving_alias or an earlier-declared joins[].alias this condition's left side reads from. Required unless left_expression is given and is unambiguous about which alias(es) it reads."
                          },
                          "left_column": {
                            "type": "string",
                            "description": "Exactly one of left_column/left_expression must be present."
                          },
                          "left_expression": {
                            "type": "string",
                            "description": "A bare SQL expression over already-declared aliases' columns (e.g. 'CAST(header.OrderDate AS DATE)') for a join key that needs a cast/derivation, not a plain column -- same free-text-SQL precedent as columns[].source.transformation. Exactly one of left_column/left_expression must be present. No trailing SQL comment, same rule as source.transformation (kimball-concepts.md)."
                          },
                          "right_column": {
                            "type": "string",
                            "description": "A column on THIS join's own object (never another alias's) -- the side being newly introduced."
                          }
                        }
                      }
                    }
                  }
                }
              }
            }
          },
          "columns": {
            "type": "array",
            "items": {
              "type": "object",
              "additionalProperties": false,
              "required": [
                "name",
                "type",
                "nullable",
                "source"
              ],
              "properties": {
                "name": {
                  "type": "string"
                },
                "type": {
                  "type": "string"
                },
                "nullable": {
                  "type": "boolean"
                },
                "pii_tag": {
                  "type": [
                    "string",
                    "null"
                  ],
                  "description": "Sensitivity tag from toolkit.yaml, if any. Drives redaction in sample_records and in anything sent to an LLM."
                },
                "scd_type": {
                  "type": [
                    "integer",
                    "null"
                  ],
                  "enum": [0, 1, 2, 3, null],
                  "description": "Carried verbatim from model-spec.json's dimensions[].attributes[].scd_type during resolution mode; null in greenfield mode or for fact columns. data-pipeline only knows how to render type 2 (declarative_pipeline modality); a non-null, non-2 value is carried for documentation but does not change generated code."
                },
                "source": {
                  "type": "object",
                  "additionalProperties": false,
                  "required": [
                    "object",
                    "column",
                    "mapping_type"
                  ],
                  "properties": {
                    "object": {
                      "type": "string"
                    },
                    "join_alias": {
                      "type": ["string", "null"],
                      "description": "Which of the table's source_joins.driving_alias or source_joins.joins[].alias this column actually comes from. Required (non-null) on every column of a table that declares source_joins; must be null/absent on a table that doesn't -- single-source tables need no alias at all."
                    },
                    "column": {
                      "type": "string"
                    },
                    "mapping_type": {
                      "type": "string",
                      "enum": [
                        "explicit_alias",
                        "name_and_type_match",
                        "llm_inferred"
                      ],
                      "description": "explicit_alias and name_and_type_match are measured (deterministic). llm_inferred requires a confidence score per confidence-rubric.md."
                    },
                    "confidence": {
                      "type": [
                        "number",
                        "null"
                      ],
                      "minimum": 0,
                      "maximum": 1
                    },
                    "basis": {
                      "type": [
                        "string",
                        "null"
                      ],
                      "description": "Required when mapping_type is llm_inferred: what evidence grounded the inference."
                    },
                    "transformation": {
                      "type": [
                        "string",
                        "null"
                      ],
                      "description": "A SQL expression to compute this column from source.object's columns (e.g. 'DATEDIFF(check_out, check_in)'), or null for a plain rename. Carried from model-spec.json's source_to_target_mappings[].transformation during resolution mode (its 'direct' sentinel translates to null here); may also be set directly in greenfield mode when a plain rename can't satisfy the target's declared type. data-pipeline renders this verbatim as a Spark SQL expression -- never invents one."
                    },
                    "source_type": {
                      "type": [
                        "string",
                        "null"
                      ],
                      "description": "The source column's actual profiled/declared type (discovery_findings.json's declared_type), independent of what mapping_type says about the mapping's confidence. Lets data-pipeline catch a declared target type that doesn't match reality and no transformation present, rather than silently rendering a bare alias that will fail or misbehave at runtime."
                    }
                  }
                }
              }
            }
          },
          "tests": {
            "type": "array",
            "items": {
              "type": "object",
              "additionalProperties": false,
              "required": [
                "type",
                "column",
                "params",
                "threshold_basis",
                "severity"
              ],
              "properties": {
                "type": {
                  "type": "string",
                  "enum": [
                    "nullability",
                    "uniqueness",
                    "referential",
                    "range",
                    "freshness"
                  ]
                },
                "column": {
                  "type": "string"
                },
                "params": {
                  "type": "object"
                },
                "threshold_basis": {
                  "type": "string",
                  "enum": [
                    "profiled",
                    "explicit_constraint",
                    "default_convention"
                  ],
                  "description": "profiled: threshold derived from observed data (e.g. observed min/max, observed null rate). explicit_constraint: read off a real PK/FK/NOT NULL/CHECK constraint. default_convention: no evidence available, toolkit default applied -- must also appear in assumptions[]."
                },
                "severity": {
                  "type": "string",
                  "enum": [
                    "blocking",
                    "warning"
                  ]
                }
              }
            }
          },
          "sample_records": {
            "type": "array",
            "description": "Bounded, redacted example rows. Sensitive columns (per toolkit.yaml) are hashed or redacted, never raw. Capped at the sample size configured in toolkit.yaml.",
            "items": {
              "type": "object"
            },
            "maxItems": 20
          },
          "row_count_estimate": {
            "type": "integer",
            "minimum": 0
          }
        }
      }
    },
    "unresolved_requirements": {
      "type": "array",
      "description": "resolution mode only: anything in the source model-spec that discovery could NOT satisfy against real objects. Never silently dropped.",
      "items": {
        "type": "object",
        "additionalProperties": false,
        "required": [
          "requirement",
          "reason"
        ],
        "properties": {
          "requirement": {
            "type": "string"
          },
          "reason": {
            "type": "string"
          }
        }
      }
    },
    "assumptions": {
      "type": "array",
      "description": "Every inference this artifact makes, with its basis. Never silent.",
      "items": {
        "type": "object",
        "additionalProperties": false,
        "required": [
          "statement",
          "basis"
        ],
        "properties": {
          "statement": {
            "type": "string"
          },
          "basis": {
            "type": "string"
          }
        }
      }
    }
  }
}